,status,totalResults,source,author,title,description,url,urlToImage,publishedAt,content
92,ok,1902,"{'id': None, 'name': 'MacRumors'}",Joe Rossignol,Apple Reseller 'Simply Mac' Apparently Shuts Down,"Apple reseller and service provider Simply Mac is apparently shutting down effective immediately after nearly sixteen years of business.





In a letter to employees today, obtained by MacRumors from multiple sources, Simply Mac CEO Rein Voigt said the compa…",https://www.macrumors.com/2022/06/09/apple-reseller-simply-mac-apparently-shuts-down/,https://images.macrumors.com/t/nIbIEfGdfeRc5Nkyb13Sj8i97r0=/1600x/article-new/2022/06/Simply-Mac-store.jpeg,2022-06-09T13:47:46Z,"Apple reseller and service provider Simply Mac is apparently shutting down effective immediately after nearly sixteen years of business.
In a letter to employees today, obtained by MacRumors from mu… [+1596 chars]"
93,ok,1902,"{'id': None, 'name': 'MarketWatch'}",Jon Swartz,: Hearing on data-privacy bill reveals contours of latest best hope for tech regulation,"National data-privacy legislation quickly gaining support on Capitol Hill and in Silicon Valley had its day in a House hearing Tuesday, paving the way for a possible vote this summer and the first significant tech regulation in more than two decades.",https://www.marketwatch.com/story/hearing-on-data-privacy-bill-reveals-contours-of-latest-best-hope-for-tech-regulation-11655221649,https://images.mktw.net/im-401917/social,2022-06-14T15:47:00Z,"National data-privacy legislation quickly gaining support on Capitol Hill and in Silicon Valley had its day in a House hearing Tuesday, paving the way for a possible vote this summer and the first si… [+2813 chars]"
94,ok,1902,"{'id': None, 'name': 'iMore'}",Stephen Warwick,Apple CarPlay could completely change how you buy gas,"One Gasoline firm is already on board...

What you need to know


A new feature coming to CarPlay could completely change how you buy gas.
Apple is planning to let developers offer support for preauthorizing fuel purchases from your dashboard. 
It could mean …",https://www.imore.com/apple-carplay-could-completely-change-how-you-buy-gas,https://www.imore.com/sites/imore.com/files/styles/large/public/field/image/2017/03/manage-apps-carplay-hero.jpg,2022-06-30T13:39:23Z,"A new CarPlay feature coming to iPhone this fall could let you pay for gas from your dashboard and preauthorize purchases before you even arrive at the pump.
Reuters has spotted a feature that passe… [+1569 chars]"
95,ok,1902,"{'id': None, 'name': 'HYPEBEAST'}","info@hypebeast.com (HYPEBEAST), HYPEBEAST",Apple’s Mixed Reality Headset Will Reportedly Feature Its New Flagship M2 Chip,Apple’s rumored mixed reality headset has been shrouded in secrecy for the past few months. Recently Apple analyst Ming-Chi Kuo predicted that the headset would launch sometime in early 2023 and is the most complicated piece of hardware the company has design…,https://hypebeast.com/2022/6/apple-mixed-reality-headset-m2-chip,https://image-cdn.hypb.st/https%3A%2F%2Fhypebeast.com%2Fimage%2F2022%2F06%2FApples-Mixed-Reality-Headset-Will-Reportedly-Feature-Its-New-Flagship-M2-Chip-tw.jpg?w=960&cbr=1&q=90&fit=max,2022-06-27T19:21:55Z,Apples rumored mixed reality headset has been shrouded in secrecy for the past few months. Recently Apple analyst Ming-Chi Kuo predicted that the headset would launch sometime in early 2023 and is th… [+1098 chars]
96,ok,1902,"{'id': None, 'name': 'Techmeme.com'}",,"Apple's CarPlay update, demoed at WWDC, lets users navigate to a pump and buy gas from its dashboard (Stephen Nellis/Reuters)","Stephen Nellis / Reuters:
Apple's CarPlay update, demoed at WWDC, lets users navigate to a pump and buy gas from its dashboard  —  Apple Inc (AAPL.O) wants you to start buying gas directly from your car dashboard as early as this fall, when the newest version…",https://www.techmeme.com/220630/p24,https://www.reuters.com/resizer/qBxnnsIEK0H3LM0CpPbgxt1opa4=/1200x628/smart/filters:quality(80)/cloudfront-us-east-2.images.arcpublishing.com/reuters/5GJEOOKKFFKP7BCCVAKHAAYJAM.jpg,2022-06-30T13:40:00Z,"The New Consumer— by Dan Frommer
A publication about how and why people spend their time and money, focusing on the most interesting and innovative companies, people, products, and trends."
97,ok,1902,"{'id': None, 'name': 'MarketWatch'}",Philip van Doorn,Deep Dive: Here’s the best way to play the S&P Dividend Aristocrat stocks,These 10 Dividend Aristocrats delivered excellent performance over the past five years; which will make the list for the next five?,https://www.marketwatch.com/story/heres-the-best-way-to-play-the-s-p-dividend-aristocrat-stocks-11657106983,https://images.mktw.net/im-577259/social,2022-07-06T11:29:00Z,"Stocks with attractive dividend yields have received a lot of coverage this year, because many have held up well when compared with the performance of the broad stock market. Dividends arent a guaran… [+10549 chars]"
98,ok,1902,"{'id': None, 'name': 'Imapenguin.com'}",Michael Doornbos,How fast can a 6502 transfer memory,The amazing Gregorio Naçu posted the article title graphic this week to bring attention to the venerable 6502 processor and poke fun at Apple's M2 chip marketing slides. He's doing probably the most ambitious single-person Commodore 64 project I know of and h…,https://imapenguin.com/how-fast-can-a-6502-transfer-memory/,https://imapenguin.com/content/images/2022/06/20d09557-8311-4239-91ec-6232d07102bd-1.png,2022-06-16T11:24:13Z,The amazing Gregorio Naçu posted the article title graphic this week to bring attention to the venerable 6502 processor and poke fun at Apple's M2 chip marketing slides. He's doing probably the most … [+8601 chars]
99,ok,1902,"{'id': 'bloomberg', 'name': 'Bloomberg'}","Cagan Koc, April Roach",Apple Resolves Dating Apps Payment Dispute With Dutch Regulator,,https://www.bloomberg.com/news/articles/2022-06-11/apple-resolves-dating-apps-payment-dispute-with-dutch-regulator,https://assets.bwbx.io/images/users/iqjWHBFdfxIU/i1a3lbn4D.mQ/v0/1200x768.jpg,2022-06-11T10:41:09Z,"Want the lowdown on European markets? In your inbox before the open, every day. 
Sign up here.
The Dutch consumer protection regulator said 
Apple Inc. has changed its unfair conditions and will n… [+150 chars]"
