,status,totalResults,source,author,title,description,url,urlToImage,publishedAt,content
29,ok,1902,"{'id': 'reuters', 'name': 'Reuters'}",,Ashurst expands U.S. footprint with office opening in Austin - Reuters.com,"International law firm Ashurst said Thursday it opened its third U.S. outpost in Austin, Texas, amid an influx of firms setting up shop in the city.",https://www.reuters.com/legal/legalindustry/ashurst-expands-us-footprint-with-office-opening-austin-2022-06-23/,https://www.reuters.com/resizer/AYrk_or9ehInZz41PW1N9YBGNQ0=/728x381/smart/filters:quality(80)/cloudfront-us-east-2.images.arcpublishing.com/reuters/UR4VPDY3FNO5VG4NOX2KIB4U5Q.jpg,2022-06-23T19:55:00Z,"(Reuters) - International law firm Ashurst said Thursday it opened its third U.S. outpost in Austin, Texas, amid an influx of firms setting up shop in the city.
Ashurst is among a small group of U.K… [+1888 chars]"
30,ok,1902,"{'id': 'reuters', 'name': 'Reuters'}",,"Global smartphone, PC shipments to decline in 2022 on China slowdown - Gartner - Reuters.com","China's slowing economy and an inflation-driven drop in consumer spending are expected to drag down global shipments of computers and smartphones this year, according to research firm Gartner.",https://www.reuters.com/technology/global-smartphone-pc-shipments-decline-2022-china-slowdown-gartner-2022-06-30/,https://www.reuters.com/resizer/2vvPgEqhFFGS-mnURNlibN66x3s=/1200x628/smart/filters:quality(80)/cloudfront-us-east-2.images.arcpublishing.com/reuters/HWNV43ZZJVKADEXEWOKYZT5LEY.jpg,2022-06-30T07:10:00Z,"June 30 (Reuters) - China's slowing economy and an inflation-driven drop in consumer spending are expected to drag down global shipments of computers and smartphones this year, according to research … [+1512 chars]"
31,ok,1902,"{'id': 'reuters', 'name': 'Reuters'}",,Futures jump after worst week for S&P 500 since March 2020 - Reuters,U.S. stock index futures climbed on Tuesday as investors returned from a long weekend to scoop up shares of megacap growth companies and banks that were hammered in a rout last week on worries over a global economic downturn.,https://www.reuters.com/markets/europe/futures-jump-after-worst-week-sp-500-since-march-2020-2022-06-21/,https://www.reuters.com/resizer/ihLx6GouRIHQIiq32PDw3qAjR7I=/1200x628/smart/filters:quality(80)/cloudfront-us-east-2.images.arcpublishing.com/reuters/UPGECQWKRZNDRNEDYMCTFFBQKQ.jpg,2022-06-21T10:48:00Z,June 21 (Reuters) - U.S. stock index futures climbed on Tuesday as investors returned from a long weekend to scoop up shares of megacap growth companies and banks that were hammered in a rout last we… [+2158 chars]
32,ok,1902,"{'id': 'reuters', 'name': 'Reuters'}",,Futures tumble on last day of a torrid first-half on growth fears - Reuters.com,U.S. stock index futures slid on Thursday on the last day of a dismal first-half of the year on worries that central banks determined to tame inflation will hamper global economic growth.,https://www.reuters.com/markets/europe/futures-tumble-last-day-torrid-first-half-growth-fears-2022-06-30/,https://www.reuters.com/resizer/YuguxBCg4P2AiEKWkyHKf-b9GFc=/1200x628/smart/filters:quality(80)/cloudfront-us-east-2.images.arcpublishing.com/reuters/33TAHTUZMFNOVFEMQ3TC6XDP3Y.jpg,2022-06-30T10:54:00Z,June 30 (Reuters) - U.S. stock index futures slid on Thursday on the last day of a dismal first-half of the year on worries that central banks determined to tame inflation will hamper global economic… [+2036 chars]
33,ok,1902,"{'id': None, 'name': 'Slashdot.org'}",BeauHD,Steve Jobs Awarded Posthumous Medal of Freedom By President Biden,"Steve Jobs, the co-founder and former CEO of Apple, has been awarded a posthumous Presidential Medal of Freedom by President Joe Biden, the White House announced Friday. The Verge reports: The Presidential Medal of Freedom is the highest US honor that can be …",https://slashdot.org/story/22/07/01/215214/steve-jobs-awarded-posthumous-medal-of-freedom-by-president-biden,https://a.fsdn.com/sd/topics/topicbeanies.gif,2022-07-02T00:45:00Z,"of the Steve Jobs' fellating by the mainstream. The guy was a salesman who often never heeded the sage advice of the experts he hired.
The person who really deserves that award is WOZNIAK.
Not real… [+2047 chars]"
34,ok,1902,"{'id': None, 'name': 'MacRumors'}",Hartley Charlton,Steve Jobs to Be Posthumously Awarded Presidential Medal of Freedom,"Apple co-founder and former CEO Steve Jobs is to be posthumously awarded the Presidential Medal of Freedom, the White House today announced.





The Presidential Medal of Freedom is the United States' highest civilian honor, presented to individuals ""who hav…",https://www.macrumors.com/2022/07/01/steve-jobs-awarded-presidential-medal-of-freedom/,https://images.macrumors.com/t/p1p6H957rFh27mgQpXHVgwKb-zM=/1600x/article-new/2020/06/steve-jobs-holding-iphone-4.jpg,2022-07-01T15:40:34Z,"Apple co-founder and former CEO Steve Jobs is to be posthumously awarded the Presidential Medal of Freedom, the White House today announced.
The Presidential Medal of Freedom is the United States' h… [+1836 chars]"
35,ok,1902,"{'id': None, 'name': 'MarketWatch'}",James Rogers,: Apple has ended imports of gold and tungsten from Russia,"Apple Inc. is no longer importing gold and tungsten from Russia, the company has confirmed to MarketWatch.",https://www.marketwatch.com/story/apple-has-ended-imports-of-gold-and-tungsten-from-russia-11656613974,https://images.mktw.net/im-567359/social,2022-06-30T18:32:00Z,"Apple Inc. is no longer importing gold and tungsten from Russia, the company has confirmed to MarketWatch.The tech giant uses a range of materials, including gold, tungsten and the metal tantalum in … [+1472 chars]"
36,ok,1902,"{'id': 'reuters', 'name': 'Reuters'}",,Google to pay $90 million to settle legal fight with app developers - Reuters,"Alphabet Inc's <a href=""https://www.reuters.com/companies/GOOGL.O"" target=""_blank"">(GOOGL.O)</a> Google has agreed to pay $90 million to settle a legal fight with app developers over the money they earned creating apps for Android smartphones and for enticing…",https://www.reuters.com/technology/google-pay-90-million-settle-legal-fight-with-app-developers-2022-07-01/,https://www.reuters.com/resizer/DXjj2xfkAYQJApaMKZ6WAKYr7OA=/1200x628/smart/filters:quality(80)/cloudfront-us-east-2.images.arcpublishing.com/reuters/MHQSTRRYRZJKBNQ5Z7IGZMMTE4.jpg,2022-07-01T00:21:00Z,"WASHINGTON, June 30 (Reuters) - Alphabet Inc's (GOOGL.O) Google has agreed to pay $90 million to settle a legal fight with app developers over the money they earned creating apps for Android smartpho… [+1887 chars]"
37,ok,1902,"{'id': 'reuters', 'name': 'Reuters'}",,Analysis: Some investors bet top growth stocks will thrive in U.S. recession - Reuters,Concerns about a possible U.S. recession are prompting some fund managers to rotate back into the big tech and growth winners of the last decade in the hope that they can better weather an economic storm.,https://www.reuters.com/markets/europe/some-investors-bet-top-growth-stocks-will-thrive-us-recession-2022-07-01/,https://www.reuters.com/resizer/g86WjNh0GP2Hy0Ryf2glSc-Dmz8=/1200x628/smart/filters:quality(80)/cloudfront-us-east-2.images.arcpublishing.com/reuters/LQH5UN7YUVIITKZNB6EDVNUL2U.jpg,2022-07-01T05:03:00Z,"NEW YORK, July 1 (Reuters) - Concerns about a possible U.S. recession are prompting some fund managers to rotate back into the big tech and growth winners of the last decade in the hope that they can… [+4637 chars]"
38,ok,1902,"{'id': 'reuters', 'name': 'Reuters'}",,Warren Buffett charity lunch fetches winning bid of $19 mln - Reuters,"A lucky, and likely wealthy, person bid more than $19 million to dine with Warren Buffett, in the 21st and final time that the billionaire businessman auctioned a private lunch to benefit a San Francisco charity.",https://www.reuters.com/business/warren-buffett-charity-lunch-fetches-winning-bid-19-mln-2022-06-18/,https://www.reuters.com/pf/resources/images/reuters/reuters-default.png?d=99,2022-06-18T02:54:00Z,"June 17 (Reuters) - A lucky, and likely wealthy, person bid more than $19 million to dine with Warren Buffett, in the 21st and final time that the billionaire businessman auctioned a private lunch to… [+2290 chars]"
39,ok,1902,"{'id': None, 'name': 'Zamzar.com'}",The Zamzar Team,How Microsoft beat Apple to buy PowerPoint for $14M (1987),This is part one of a series of stories from Robert Gaskins who helped invent PowerPoint at Forethought Inc. in 1984. It was the first significant acquisition made by Microsoft. We interviewed Robert about the process of building a startup in the 1980s and… R…,https://blog.zamzar.com/2016/06/10/deal-of-the-century-how-microsoft-beat-apple-to-buy-powerpoint-for-14-million/,https://blog.zamzar.com/wp-content/uploads/2016/06/microsoft-reception-menlo-park.png,2022-06-28T09:18:22Z,This is part one of a series of stories from Robert Gaskins who helped invent PowerPoint at Forethought Inc. in 1984. It was the first significant acquisition made by Microsoft. We interviewed Robert… [+13871 chars]
40,ok,1902,"{'id': 'business-insider', 'name': 'Business Insider'}",rbradbury@insider.com (Rosie Bradbury),Apple's buy-now-pay-later rival to AfterPay. A lawyer who helps victims of predatory lending says Apple could use the data it has on you to push reckless spending.,"A lawyer who represents victims of predatory lending said Apple's entrance into Buy Now, Pay Later makes new regulation 'even more urgent'",https://www.businessinsider.com/apple-user-data-overspending-apple-pay-later-2022-6,https://i.insider.com/626cfb9f0983640018c08ee0?width=1200&format=jpeg,2022-06-11T14:18:16Z,"Apple is the latest entrant to the 
buy-now-pay-later market, but unlike rivals such as Klarna or AfterPay it already holds huge amounts of information about how its customers spend their money.
On… [+3912 chars]"
41,ok,1902,"{'id': 'reuters', 'name': 'Reuters'}",,Legal clashes await U.S. companies covering workers' abortion costs - Reuters,"A growing number of large U.S. companies have said they will cover travel costs for employees who must leave their home states to get abortions, but these new policies could expose businesses to lawsuits and even potential criminal liability, legal experts sa…",https://www.reuters.com/world/us/legal-clashes-await-us-companies-covering-workers-abortion-costs-2022-06-26/,https://www.reuters.com/resizer/8weV1C07X3uyiWXTBZs8tjpS_6A=/1200x628/smart/filters:quality(80)/cloudfront-us-east-2.images.arcpublishing.com/reuters/CGP3Q2LOQNMG3PV2T6KBZXU7CA.jpg,2022-06-26T11:05:00Z,"June 26 (Reuters) - A growing number of large U.S. companies have said they will cover travel costs for employees who must leave their home states to get abortions, but these new policies could expos… [+5605 chars]"
42,ok,1902,"{'id': None, 'name': 'Hindustan Times'}",Himani Jha,iPhone 14 Pro Max: Release date to expected specifications; Everything we know so far - HT Tech,"<ol><li>iPhone 14 Pro Max: Release date to expected specifications; Everything we know so far  HT Tech
</li><li>I asked AI to make an iPhone 14 render, and it's as weird as you'd imagine  Techradar
</li><li>Is this the iPhone 14? no more Mini! No more notch…",https://tech.hindustantimes.com/tech/news/iphone-14-pro-max-release-date-to-expected-specifications-everything-we-know-so-far-71654786289155.html,https://images.hindustantimes.com/tech/img/2022/06/09/1600x900/AUPEF7SBPFIZTCEHMOHOODMLX4_1650272569284_1654786511391.webp,2022-06-09T14:59:57Z,Apple is just a few more months away from the launch of its iPhone 14 line up. The rumours and speculations regarding the features of iPhone 14 Pro models are already creating much hype on social med… [+2504 chars]
43,ok,1902,"{'id': 'reuters', 'name': 'Reuters'}",,Futures rise as investors scale back rate hike expectations - Reuters.com,U.S. stock index futures rose on Friday as signs of slowing economic growth and falling commodity prices eased expectations over how high the Federal Reserve will raise interest rates to rein in inflation.,https://www.reuters.com/markets/europe/futures-rise-investors-scale-back-rate-hike-expectations-2022-06-24/,https://www.reuters.com/resizer/N7ZhjymodvwNugIATBo1_ZJUbTQ=/1200x628/smart/filters:quality(80)/cloudfront-us-east-2.images.arcpublishing.com/reuters/M3FTQOPZ4JIL5ER4JDMINWSC3Y.jpg,2022-06-24T11:52:00Z,June 24 (Reuters) - U.S. stock index futures rose on Friday as signs of slowing economic growth and falling commodity prices eased expectations over how high the Federal Reserve will raise interest r… [+2721 chars]
44,ok,1902,"{'id': None, 'name': 'MacRumors'}",Sami Fathi,"WWDC 2022 Rumor Report Card: MacBook Air With White Bezels, iOS 16 Lock Screen Changes, and More","This week, Apple held a jam-packed WWDC keynote where it announced iOS 16, iPadOS 16, macOS Ventura, watchOS 9, the next-generation of Apple silicon with M2, a new redesigned MacBook Air, and a revamped 13-inch MacBook Pro.





As is typical with all of Appl…",https://www.macrumors.com/2022/06/09/wwdc-2022-rumor-report-card/,https://images.macrumors.com/t/rDpmJID94Phz81guugMeevsuzc4=/2000x/article-new/2022/05/wwdc-live-stream.jpg,2022-06-09T10:05:34Z,"This week, Apple held a jam-packed WWDC keynote where it announced iOS 16, iPadOS 16, macOS Ventura, watchOS 9, the next-generation of Apple silicon with M2, a new redesigned MacBook Air, and a revam… [+3715 chars]"
45,ok,1902,"{'id': None, 'name': '9to5Mac'}",Zac Hall,Apple plans to bargain with Maryland retail store after union vote,"Apple intends to bargain with the newly formed labor union at its Maryland retail store, according to Reuters. Apple Inc will not challenge the results of a vote by workers at its Towson, Maryland, store to join a labor union and intends to participate in the…",https://9to5mac.com/2022/06/24/apple-union-bargaining/,https://i0.wp.com/9to5mac.com/wp-content/uploads/sites/6/2022/06/apple-store-union.jpeg?resize=1200%2C628&quality=82&strip=all&ssl=1,2022-06-24T20:57:30Z,"Apple intends to bargain with the newly formed labor union at its Maryland retail store, according to Reuters.
Apple Inc will not challenge the results of a vote by workers at its Towson, Maryland, … [+1147 chars]"
46,ok,1902,"{'id': None, 'name': 'MarketWatch'}",Emily Bary,The Ratings Game: Apple is the safest play in consumer hardware but isn’t immune to this one ‘growing risk’,"Apple Inc. faces risks from an expected slowdown in tech spending, but it's still the safest bet among consumer-hardware names, according to Morgan Stanley.",https://www.marketwatch.com/story/apple-is-the-safest-play-in-consumer-hardware-but-isnt-immune-to-this-one-growing-risk-11655311360,https://images.mktw.net/im-564714/social,2022-06-15T16:42:00Z,"Apple Inc. faces risks from an expected slowdown in tech spending, but its still the safest play among consumer-hardware names, according to Morgan Stanley. While low- and mid-range consumer spending… [+2260 chars]"
47,ok,1902,"{'id': 'time', 'name': 'Time'}",Jillian Deutsch / Bloomberg,Apple Products Set to Use Common Charging Point After EU Deal,All smartphones and tablets would have to use a common charger under a provisional European Union agreement clinched on Tuesday.,https://time.com/6185146/apple-chargers-eu-parliament/,https://api.time.com/wp-content/uploads/2022/06/apple-chargers-eu-parliament.jpg?quality=85&w=1200&h=628&crop=1,2022-06-07T20:26:50Z,"All smartphones and tablets would have to use a common charger under a provisional European Union agreement clinched on Tuesday.
The plan would force all companies—most notably Apple Inc.—to make ph… [+1649 chars]"
48,ok,1902,"{'id': None, 'name': 'Entrepreneur'}",Komal Bhattar,3 Buffett Stocks to Buy on the Dip,Warren Buffett’s strategic investment decisions have been a guide for retail inventors for decades. And we think investors should consider buying the dip in these fundamentally solid stocks from his...,https://www.entrepreneur.com/article/429495,https://assets.entrepreneur.com/providers/stocknews/hero-image-stocknews-429495.jpeg,2022-06-14T15:31:34Z,Warren Buffett's strategic investment decisions have been a guide for retail inventors for decades. And we think investors should consider buying the dip in these fundamentally solid stocks from his … [+6466 chars]
49,ok,1902,"{'id': 'the-globe-and-mail', 'name': 'The Globe And Mail'}",Scott Barlow,"'It could be a long, cold, summer for housing': BMO economist - The Globe and Mail","<ol><li>'It could be a long, cold, summer for housing': BMO economist  The Globe and Mail
</li><li>Canadian Real Estate's Worst Case Is A 30% Price Drop, Still Down By 2027: RBC - Better Dwelling  Better Dwelling
</li><li>Posthaste: So long, seller's market…",https://www.theglobeandmail.com/investing/markets/inside-the-market/article-it-could-be-a-long-cold-summer-for-housing-bmo-economist/,https://www.theglobeandmail.com/resizer/_xfq6fPUAGSW8O0eD9G-fBSv7ds=/1200x824/filters:quality(80)/cloudfront-us-east-1.images.arcpublishing.com/tgam/4TQ2KCX67FA7PNNMD2HOKUVKSA.jpg,2022-06-07T11:55:06Z,"A daily roundup of research and analysis from The Globe and Mails market strategist Scott Barlow
BMO chief strategist Brian Belski notes more difficult conditions for Canadian equity investors,
Whi… [+4425 chars]"
50,ok,1902,"{'id': 'reuters', 'name': 'Reuters'}",,Futures slip as tech-driven rally loses steam - Reuters,"U.S. stock index futures slipped on Wednesday as a rally in technology and growth stocks from the previous session eased, while higher oil prices stoked worries of a further rise in global inflation.",https://www.reuters.com/markets/europe/futures-slip-tech-driven-rally-loses-steam-2022-06-08/,https://www.reuters.com/resizer/LPvw_VKobY1p5RqiqtAnW0MuQQw=/1200x628/smart/filters:quality(80)/cloudfront-us-east-2.images.arcpublishing.com/reuters/XDGWLPUDWRJZFD74HS36QCZVTM.jpg,2022-06-08T11:12:00Z,"June 8 (Reuters) - U.S. stock index futures slipped on Wednesday as a rally in technology and growth stocks from the previous session eased, while higher oil prices stoked worries of a further rise i… [+1793 chars]"
51,ok,1902,"{'id': 'reuters', 'name': 'Reuters'}",,"Futures rebound as Tesla, other growth stocks gain - Reuters.com","U.S. stock index futures rose on Thursday, led by Tesla and other growth shares following a broad selloff on Wall Street on worries over surging inflation and the path for interest rate hikes.",https://www.reuters.com/markets/europe/futures-rebound-tesla-other-growth-stocks-gain-2022-06-09/,https://www.reuters.com/resizer/xKeN3WiRK4ThFl12TVkDsOxvc-c=/1200x628/smart/filters:quality(80)/cloudfront-us-east-2.images.arcpublishing.com/reuters/GGPAT3SUDVMKDKXCDLG5XAXI2I.jpg,2022-06-09T11:24:00Z,"June 9 (Reuters) - U.S. stock index futures rose on Thursday, led by Tesla and other growth shares following a broad selloff on Wall Street on worries over surging inflation and the path for interest… [+2325 chars]"
52,ok,1902,"{'id': 'reuters', 'name': 'Reuters'}",,Futures slump as recession fears loom - Reuters,"U.S. stock index futures fell sharply on Thursday, pointing to a reversal of the previous session's rally, as fears of a recession grew after the Federal Reserve's biggest rate hike in nearly three decades.",https://www.reuters.com/markets/europe/futures-slump-recession-fears-loom-2022-06-16/,https://www.reuters.com/resizer/yuYS4I-gZ50-zjI4JHRvKP5Op9U=/1200x628/smart/filters:quality(80)/cloudfront-us-east-2.images.arcpublishing.com/reuters/SFHCMBHGYRPUXCAMUI6M6XGD3A.jpg,2022-06-16T09:44:00Z,"June 16 (Reuters) - U.S. stock index futures fell sharply on Thursday, pointing to a reversal of the previous session's rally, as fears of a recession grew after the Federal Reserve's biggest rate hi… [+1751 chars]"
53,ok,1902,"{'id': 'reuters', 'name': 'Reuters'}",,New Zealand dairy and meat farmers disappointed in EU trade deal - Reuters,"New Zealand dairy, sheep and beef farmers are largely disappointed by the newly signed New Zealand-European Union free trade agreement, lamenting it provides little new access to the profitable market for meat and dairy.",https://www.reuters.com/markets/commodities/new-zealand-dairy-meat-farmers-disappointed-eu-trade-deal-2022-07-01/,https://www.reuters.com/pf/resources/images/reuters/reuters-default.png?d=100,2022-07-01T03:25:00Z,"WELLINGTON, July 1 (Reuters) - New Zealand dairy, sheep and beef farmers are largely disappointed by the newly signed New Zealand-European Union free trade agreement, lamenting it provides little new… [+2212 chars]"
54,ok,1902,"{'id': 'reuters', 'name': 'Reuters'}",,EU fails to agree corporate tax reform as Hungary vetoes overhaul - Reuters,"Hungary's Finance Minister Mihaly Varga told his EU counterparts on Friday that his country could not support a reform of corporate taxation at this stage, effectively preventing a deal at EU level.",https://www.reuters.com/markets/europe/eu-fails-agree-corporate-tax-reform-hungary-vetoes-overhaul-2022-06-17/,https://www.reuters.com/resizer/JIHGWEcrxnMkyri_8omtUQlLdFc=/1200x628/smart/filters:quality(80)/cloudfront-us-east-2.images.arcpublishing.com/reuters/KP66BWFMZBJY7FTN2YKNOUAREI.jpg,2022-06-17T11:54:00Z,"LUXEMBOURG, June 17 (Reuters) - Hungary's Finance Minister Mihaly Varga told his EU counterparts on Friday that his country could not support a reform of corporate taxation at this stage, effectively… [+2258 chars]"
55,ok,1902,"{'id': 'reuters', 'name': 'Reuters'}",,Gartner revises 2022 mobile sales estimates to fall 7.1% - Reuters.com,"Gartner forecast global mobile phone sales to fall 7.1% this year on Thursday, revising its earlier estimate of a growth of 2.2%, citing inflation, Russia's invasion of Ukraine and lockdowns in China.",https://www.reuters.com/business/media-telecom/gartner-revises-2022-mobile-sales-estimates-fall-71-2022-06-30/,https://www.reuters.com/resizer/n7KsvwqMnKCoUsx0Ynd5y94Veew=/1200x628/smart/filters:quality(80)/cloudfront-us-east-2.images.arcpublishing.com/reuters/CGXMILVKSNJJZPPDYF5M46NXYA.jpg,2022-06-30T07:06:00Z,"STOCKHOLM, June 30 (Reuters) - Gartner forecast global mobile phone sales to fall 7.1% this year on Thursday, revising its earlier estimate of a growth of 2.2%, citing inflation, Russia's invasion of… [+2017 chars]"
56,ok,1902,"{'id': 'reuters', 'name': 'Reuters'}",,Taiwan's Foxconn raises full-year outlook on strong tech demand - Reuters.com,"Taiwan's Foxconn <a href=""https://www.reuters.com/companies/2317.TW"" target=""_blank"">(2317.TW)</a>, the world's largest contract electronics maker, raised its full-year business outlook on Monday thanks to strong sales of smartphones and servers despite conce…",https://www.reuters.com/technology/taiwans-foxconn-raises-full-year-outlook-strong-tech-demand-2022-07-05/,https://www.reuters.com/resizer/VYMItqp-Aj6TP9xI0uk1D7rhL10=/1200x628/smart/filters:quality(80)/cloudfront-us-east-2.images.arcpublishing.com/reuters/IY6AO27P3NI5TKGYECD5ERXG5A.jpg,2022-07-05T02:11:00Z,"TAIPEI, July 4 (Reuters) - Taiwan's Foxconn (2317.TW), the world's largest contract electronics maker, raised its full-year business outlook on Monday thanks to strong sales of smartphones and server… [+2505 chars]"
57,ok,1902,"{'id': None, 'name': 'Moneycontrol'}",Reuters,Wall Street suffers biggest weekly loss since January after hot CPI data - Moneycontrol,"<ol><li>Wall Street suffers biggest weekly loss since January after hot CPI data  Moneycontrol
</li><li>S&P 500 Slumps as Surprise Jump in Inflation to Keep Fed on Rate Hike Trail By Investing.com  Investing.com
</li><li>Wall St suffers biggest weekly loss …",https://www.moneycontrol.com/news/business/markets/wall-street-suffers-biggest-weekly-loss-since-january-after-hot-cpi-data-8671661.html,https://images.moneycontrol.com/static-mcnews/2020/09/wall-street-770x433.jpg,2022-06-11T00:47:12Z,US stocks posted their biggest weekly percentage declines since January and ended sharply lower on the day Friday as a steeper-than-expected rise in US consumer prices in May fueled fears of more agg… [+2744 chars]
58,ok,1902,"{'id': None, 'name': 'AppleInsider'}",news@appleinsider.com (Malcolm Owen),Ericsson brings 5G patent infringement battle to the UK,"Ericsson is extending its legal battle with Apple over 5G patents, with new filings indicating the patent infringement fight will also be taking place in the United Kingdom.In early 2022, Ericsson and Apple scaled up their disagreements over 5G patents that E…",https://appleinsider.com/articles/22/06/20/ericsson-brings-5g-patent-infringement-battle-to-the-uk,https://photos5.appleinsider.com/gallery/48971-95765-46559-90752-000-lead-5G-xl-xl.jpg,2022-06-20T11:06:27Z,AppleInsider is supported by its audience and may earn commission as an Amazon Associate and affiliate partner on qualifying purchases. These affiliate partnerships do not influence our editorial con… [+1680 chars]
59,ok,1902,"{'id': None, 'name': 'AppleInsider'}",news@appleinsider.com (Amber Neely),Apple honors winners in the 2022 Apple Design Awards,"On Monday, Apple announced the winners of its annual Design Awards, praising developers who have produced exceptional apps and games.Apple's annual Design Awards honor ""excellence in innovation, ingenuity, and technical achievement in app and game design."" An…",https://appleinsider.com/articles/22/06/07/apple-honors-winners-in-the-2022-apple-design-awards,https://photos5.appleinsider.com/gallery/48662-95041-apple-design-award-2022-xl.jpg,2022-06-07T00:54:54Z,AppleInsider is supported by its audience and may earn commission as an Amazon Associate and affiliate partner on qualifying purchases. These affiliate partnerships do not influence our editorial con… [+4198 chars]
